{
  "format": "scene",
  "version": 1,
  "cell_size": 1.0,
  "up": "z",
  "objects": [
    {
      "type": "ground",
      "n": 22,
      "color": [
        92,
        132,
        92
      ]
    },
    {
      "type": "occupancy",
      "name": "map",
      "grid": [
        [
          0,
          0,
          0,
          0,
          0,
          0,
          0,
          0,
          0,
          0,
          0,
          0,
          0,
          0,
          0,
          0,
          0,
          0,
          0,
          0
        ],
        [
          0,
          0,
          0,
          0,
          0,
          0,
          0,
          0,
          0,
          0,
          0,
          0,
          0,
          0,
          0,
          0,
          0,
          0,
          0,
          0
        ],
        [
          0,
          0,
          0,
          0,
          0,
          0,
          0,
          0,
          0,
          0,
          0,
          0,
          0,
          0,
          0,
          0,
          0,
          0,
          0,
          0
        ],
        [
          0,
          0,
          0,
          1,
          1,
          1,
          0,
          0,
          0,
          0,
          0,
          0,
          0,
          0,
          0,
          0,
          0,
          0,
          0,
          0
        ],
        [
          0,
          0,
          0,
          1,
          1,
          1,
          0,
          0,
          0,
          0,
          0,
          0,
          0,
          0,
          0,
          0,
          0,
          0,
          0,
          0
        ],
        [
          0,
          0,
          0,
          1,
          1,
          1,
          0,
          0,
          0,
          0,
          0,
          0,
          0,
          1,
          1,
          1,
          0,
          0,
          0,
          0
        ],
        [
          0,
          0,
          0,
          0,
          0,
          0,
          0,
          0,
          0,
          0,
          0,
          0,
          0,
          1,
          1,
          1,
          0,
          0,
          0,
          0
        ],
        [
          0,
          0,
          0,
          0,
          0,
          0,
          0,
          0,
          0,
          0,
          0,
          0,
          0,
          1,
          1,
          1,
          0,
          0,
          0,
          0
        ],
        [
          0,
          0,
          0,
          0,
          0,
          0,
          0,
          0,
          0,
          0,
          0,
          0,
          0,
          0,
          0,
          0,
          0,
          0,
          0,
          0
        ],
        [
          0,
          0,
          0,
          0,
          0,
          0,
          0,
          0,
          0,
          0,
          0,
          0,
          0,
          0,
          0,
          0,
          0,
          0,
          0,
          0
        ],
        [
          0,
          0,
          1,
          1,
          0,
          0,
          0,
          0,
          0,
          0,
          0,
          0,
          0,
          0,
          0,
          0,
          0,
          0,
          0,
          0
        ],
        [
          0,
          0,
          1,
          1,
          0,
          0,
          0,
          0,
          0,
          0,
          0,
          0,
          0,
          0,
          0,
          0,
          0,
          0,
          0,
          0
        ],
        [
          0,
          0,
          1,
          1,
          0,
          0,
          0,
          0,
          0,
          0,
          0,
          0,
          0,
          0,
          0,
          0,
          0,
          0,
          0,
          0
        ],
        [
          0,
          0,
          0,
          0,
          0,
          0,
          0,
          0,
          0,
          0,
          0,
          0,
          0,
          0,
          0,
          0,
          0,
          0,
          0,
          0
        ],
        [
          0,
          0,
          0,
          0,
          0,
          0,
          0,
          0,
          1,
          1,
          1,
          1,
          1,
          1,
          1,
          1,
          0,
          0,
          0,
          0
        ],
        [
          0,
          0,
          0,
          0,
          0,
          0,
          0,
          0,
          1,
          1,
          1,
          1,
          1,
          1,
          1,
          1,
          0,
          0,
          0,
          0
        ],
        [
          0,
          0,
          0,
          0,
          0,
          0,
          0,
          0,
          0,
          0,
          0,
          0,
          0,
          0,
          0,
          0,
          0,
          0,
          0,
          0
        ],
        [
          0,
          0,
          0,
          0,
          0,
          0,
          0,
          0,
          0,
          0,
          0,
          0,
          0,
          0,
          0,
          0,
          0,
          0,
          0,
          0
        ],
        [
          0,
          0,
          0,
          0,
          0,
          0,
          0,
          0,
          0,
          0,
          0,
          0,
          0,
          0,
          0,
          0,
          0,
          0,
          0,
          0
        ],
        [
          0,
          0,
          0,
          0,
          0,
          0,
          0,
          0,
          0,
          0,
          0,
          0,
          0,
          0,
          0,
          0,
          0,
          0,
          0,
          0
        ]
      ],
      "origin": [
        1,
        1,
        0
      ],
      "cell": 1.0,
      "color": [
        150,
        155,
        170
      ]
    }
  ]
}